{
  "id": "box_unstable",
  "name": "Dimensionally Unstable Box",
  "tier": 4,
  "keyCost": 50,
  "forbidSelfDrop": true,
  "dropTable": {
    "rolls": 1,
    "entries": [
      { "type": "BOX", "weight": 2500, "boxId": "box_cardboard", "count": { "min": 5, "max": 20 } },
      { "type": "BOX", "weight": 2000, "boxId": "box_wooden", "count": { "min": 2, "max": 6 } },
      { "type": "BOX", "weight": 1200, "boxId": "box_iron", "count": { "min": 1, "max": 3 } },

      {
        "type": "ITEM",
        "weight": 1800,
        "itemId": "itm_glitch_crystal",
        "rarity": "EPIC",
        "staticModsPool": ["m_confetti_burst", "m_rainbow_text"]
      },
      { "type": "CURRENCY", "weight": 1500, "currency": "KEYS", "amount": { "min": 5, "max": 10 } },
      {
        "type": "MATERIAL",
        "weight": 1000,
        "materialId": "mat_scrap_chunk",
        "amount": { "min": 10, "max": 25 }
      }
    ]
  }
}
